{
  "protocol_version": "agent.v1",
  "step_id": "step_01975d8c-72f5-7f1e-b111-000000000003",
  "thread_id": "thread_01975d8c-72f5-7f1e-b111-000000000002",
  "kind": "agent_run",
  "run_id": "run_01975d8c-72f5-7f1e-9b7e-c7ef3e0a1000",
  "summary": "catalog dry-run completed",
  "payload": {
    "agent_id": "execution_review",
    "status": "completed"
  },
  "created_at": "2026-06-28T09:12:31Z"
}
